{
  "$schema": "../../schemas/p4-evidence-v1.schema.json",
  "schemaVersion": "p4-evidence-v1",
  "evidenceId": "p4-contract-baseline-20260731",
  "phase": "P4",
  "source": {
    "baseCommit": "34559b5a55fbc3b171e3f472080729795632b74f",
    "contractCommit": "9cc83ee0b2b993bc3e3acff99ccdfb7d5cb6aa07",
    "branch": "codex/p4-contract-baseline",
    "upstreamBase": "db52e28f4d9ded852ab3942cea316258ae4ef346"
  },
  "environment": {
    "os": "windows",
    "architecture": "x64",
    "node": "24.18.1",
    "npm": "11.16.0",
    "filesystem": "NTFS",
    "environmentClass": "local-windows-x64-ntfs-run-owned",
    "privatePathsPersisted": false
  },
  "admissions": [
    {
      "lane": "build",
      "version": "0.146.0",
      "artifactId": "codex-0.146.0-windows-x64",
      "executableSha256": "bc343ba420dc2e2e9f59e6fc5e5bf0aae1cd8c771fc319665241fc9c0271fddb",
      "status": "accepted",
      "schemaExecution": "executed-pass",
      "lifecycleExecution": "same-as-current"
    },
    {
      "lane": "current",
      "version": "0.146.0",
      "artifactId": "codex-0.146.0-windows-x64",
      "executableSha256": "bc343ba420dc2e2e9f59e6fc5e5bf0aae1cd8c771fc319665241fc9c0271fddb",
      "status": "accepted",
      "schemaExecution": "executed-pass",
      "lifecycleExecution": "executed-pass"
    },
    {
      "lane": "previous",
      "version": "0.145.0",
      "artifactId": "codex-0.145.0-windows-x64",
      "executableSha256": "83751f15cb6a0a7b97df67752c001e3fe1c20e18ffbfec3ff63567296205eb6c",
      "status": "accepted",
      "schemaExecution": "executed-pass",
      "lifecycleExecution": "executed-pass"
    }
  ],
  "snapshot": {
    "path": "contracts/codex/snapshots",
    "treeSha256": "820456f8bdc229db1076604cafbddfd75974310e2fe0936136f6748dc8d21749",
    "fileCount": 3881,
    "totalBytes": 13852289,
    "independentRoots": 2,
    "independentTreeSha256": [
      "820456f8bdc229db1076604cafbddfd75974310e2fe0936136f6748dc8d21749",
      "820456f8bdc229db1076604cafbddfd75974310e2fe0936136f6748dc8d21749"
    ],
    "byteDiffExitCode": 0,
    "normalization": "aggregate-json-object-key-order-only",
    "stableExperimentalSeparated": true
  },
  "localChecks": [
    {
      "id": "p4-npm-ci",
      "requirementIds": ["P4-2", "P4-6", "X15"],
      "fixtureIds": ["P4-NPM-CI-001"],
      "trial": 1,
      "retryCount": 0,
      "timeout": false,
      "rawExitCode": 0,
      "executionStatus": "executed-pass",
      "behaviorStatus": null,
      "expected": "exact npm clean install preserves the lock and reports no audit issue",
      "observed": "3 packages installed, 4 audited, 0 vulnerabilities",
      "artifactSha256": "db1fb9ad6eb54eaabddc2f138c48435bd04feb04079b51c37838375e2b3e4f8b",
      "runtimeEnforced": false,
      "deferredPhase": null
    },
    {
      "id": "p4-targeted-contract",
      "requirementIds": ["P4-4", "P4-5", "P4-7"],
      "fixtureIds": ["P4-TARGETED-GREEN-001"],
      "trial": 1,
      "retryCount": 0,
      "timeout": false,
      "rawExitCode": 0,
      "executionStatus": "executed-pass",
      "behaviorStatus": null,
      "expected": "all P4 contract tests pass",
      "observed": "33 of 33 contract tests passed",
      "artifactSha256": null,
      "runtimeEnforced": false,
      "deferredPhase": null
    },
    {
      "id": "p4-current-previous-lifecycle",
      "requirementIds": ["P4-5", "X13", "X14"],
      "fixtureIds": ["P4-LIFECYCLE-CURRENT-DIRECT-001", "P4-LIFECYCLE-CURRENT-BROKER-001", "P4-LIFECYCLE-PREVIOUS-DIRECT-BROKER-001"],
      "trial": 1,
      "retryCount": 0,
      "timeout": false,
      "rawExitCode": 0,
      "executionStatus": "executed-pass",
      "behaviorStatus": "red",
      "expected": "both stable lanes execute core direct and broker lifecycle while broker handshake drift remains visible",
      "observed": "four runs passed; broker hello unsupported and broker initialize synthetic",
      "artifactSha256": null,
      "runtimeEnforced": false,
      "deferredPhase": "v0.2"
    },
    {
      "id": "p4-snapshot-reproduction",
      "requirementIds": ["P4-3", "P4-4"],
      "fixtureIds": ["P4-SNAPSHOT-REPRO-001"],
      "trial": 1,
      "retryCount": 0,
      "timeout": false,
      "rawExitCode": 0,
      "executionStatus": "executed-pass",
      "behaviorStatus": null,
      "expected": "independent generation and committed bytes have one raw-byte-framed tree digest",
      "observed": "two independent roots matched the committed tree with byte diff exit 0",
      "artifactSha256": "820456f8bdc229db1076604cafbddfd75974310e2fe0936136f6748dc8d21749",
      "runtimeEnforced": false,
      "deferredPhase": null
    },
    {
      "id": "p4-p3-validator",
      "requirementIds": ["P4-6", "X1", "X2", "X3", "X4", "X5"],
      "fixtureIds": ["P4-P3-VALIDATOR-001"],
      "trial": 1,
      "retryCount": 0,
      "timeout": false,
      "rawExitCode": 0,
      "executionStatus": "executed-pass",
      "behaviorStatus": null,
      "expected": "P3 validator remains green",
      "observed": "P3 validator passed with P4 evidence included in its privacy traversal",
      "artifactSha256": "a6033a05ebecd4ff5bca3a5924ff06e55a2e2de9b41541da2c050642102dbb5d",
      "runtimeEnforced": false,
      "deferredPhase": null
    },
    {
      "id": "p4-p3-targeted",
      "requirementIds": ["P4-6", "X1", "X2", "X3", "X4", "X5"],
      "fixtureIds": ["P4-P3-TARGETED-001"],
      "trial": 1,
      "retryCount": 0,
      "timeout": false,
      "rawExitCode": 0,
      "executionStatus": "executed-pass",
      "behaviorStatus": null,
      "expected": "all P3 targeted security fixtures remain green",
      "observed": "11 of 11 P3 targeted tests passed",
      "artifactSha256": null,
      "runtimeEnforced": false,
      "deferredPhase": null
    },
    {
      "id": "p4-full-regression",
      "requirementIds": ["P4-6", "X8"],
      "fixtureIds": ["P4-FULL-REGRESSION-001"],
      "trial": 1,
      "retryCount": 0,
      "timeout": false,
      "rawExitCode": 1,
      "executionStatus": "executed-fail",
      "behaviorStatus": "blocked-with-evidence",
      "expected": "P3 final tests plus additive P4 tests pass without skips",
      "observed": "pre-final source passed 159 of 160; the unchanged localized taskkill child-exit race failed and passed 1 of 1 alone",
      "artifactSha256": null,
      "runtimeEnforced": false,
      "deferredPhase": null
    },
    {
      "id": "p4-build-regression",
      "requirementIds": ["P4-2", "P4-6", "X8"],
      "fixtureIds": ["P4-BUILD-REGRESSION-001"],
      "trial": 1,
      "retryCount": 0,
      "timeout": false,
      "rawExitCode": 0,
      "executionStatus": "executed-pass",
      "behaviorStatus": null,
      "expected": "exact build Codex preserves the P2 generated schema digest and TypeScript build",
      "observed": "generated schema digest remained exact and TypeScript compilation passed",
      "artifactSha256": "e504c5f04a3157a41a481bfc20cc77b8af58e4c750dcb47ad4453899779d4834",
      "runtimeEnforced": false,
      "deferredPhase": null
    },
    {
      "id": "p4-claude-minimum-strict",
      "requirementIds": ["P4-6", "X9"],
      "fixtureIds": ["P4-CLAUDE-MINIMUM-001"],
      "trial": 1,
      "retryCount": 0,
      "timeout": false,
      "rawExitCode": 0,
      "executionStatus": "executed-pass",
      "behaviorStatus": null,
      "expected": "minimum supported Claude strict validation passes",
      "observed": "strict marketplace and plugin validation passed 2 of 2",
      "artifactSha256": "180d7b279455e8b89d4353a5146447be2f80b80fb0db14bdc6dd9cb98c0aef09",
      "runtimeEnforced": false,
      "deferredPhase": null
    },
    {
      "id": "p4-claude-current-strict",
      "requirementIds": ["P4-6", "X9"],
      "fixtureIds": ["P4-CLAUDE-CURRENT-001"],
      "trial": 1,
      "retryCount": 0,
      "timeout": false,
      "rawExitCode": 0,
      "executionStatus": "executed-pass",
      "behaviorStatus": null,
      "expected": "current admitted Claude strict validation passes",
      "observed": "strict marketplace and plugin validation passed 2 of 2",
      "artifactSha256": "af5bf1f1b2aadffc768eccd787084c6fdf9ba81624cbe96c1c6d9ac1a1550231",
      "runtimeEnforced": false,
      "deferredPhase": null
    },
    {
      "id": "p4-actionlint",
      "requirementIds": ["P4-6", "X15"],
      "fixtureIds": ["P4-ACTIONLINT-001"],
      "trial": 1,
      "retryCount": 0,
      "timeout": false,
      "rawExitCode": 0,
      "executionStatus": "executed-pass",
      "behaviorStatus": null,
      "expected": "pinned actionlint reports no affected workflow issue",
      "observed": "no workflow lint findings",
      "artifactSha256": "54ca21be3de4c7cfa26914aa8b61bd76bf573ef3caac5f80d110558cdf241718",
      "runtimeEnforced": false,
      "deferredPhase": null
    },
    {
      "id": "p4-zizmor",
      "requirementIds": ["P4-6", "X15"],
      "fixtureIds": ["P4-ZIZMOR-001"],
      "trial": 1,
      "retryCount": 0,
      "timeout": false,
      "rawExitCode": 0,
      "executionStatus": "executed-pass",
      "behaviorStatus": null,
      "expected": "pinned Zizmor reports no affected workflow issue",
      "observed": "offline pedantic strict-collection reported no findings",
      "artifactSha256": "607192add27b5b8cff054605ca2c01fc69629d700724ff2401265e57204610c0",
      "runtimeEnforced": false,
      "deferredPhase": null
    },
    {
      "id": "p4-osv-scanner",
      "requirementIds": ["P4-6", "X15"],
      "fixtureIds": ["P4-OSV-001"],
      "trial": 1,
      "retryCount": 0,
      "timeout": false,
      "rawExitCode": 0,
      "executionStatus": "executed-pass",
      "behaviorStatus": null,
      "expected": "pinned OSV scanner reports no affected dependency vulnerability",
      "observed": "3 locked packages scanned with no issues",
      "artifactSha256": "0cdd113610126d5dfd5e12ad0e0b4f3e879291ff19bb43b0c52ed2f2c2df1a37",
      "runtimeEnforced": false,
      "deferredPhase": null
    },
    {